{
  "schema_version": 1,
  "reported_at": 1899997000,
  "boot_id": "bbbbbbbb-bbbb-4bbb-8bbb-bbbbbbbbbbbb",
  "agent_version": "0.1.0",
  "core_version": "0.1.0",
  "identity": "authenticated",
  "control_plane": "online",
  "policy": "active",
  "node_assignment": "assigned",
  "data_plane": "connected",
  "traffic": "active",
  "health": "healthy",
  "display": "connected",
  "traffic_mode": "policy",
  "active_projection": {
    "projection_id": "11111111-1111-4111-8111-111111111111",
    "generation": 42,
    "content_hash": "sha256:0000000000000000000000000000000000000000000000000000000000000000"
  },
  "phase": "data_plane_active",
  "last_transition": {
    "dimension": "data_plane",
    "from": "connecting",
    "to": "connected",
    "reason_code": "peer_authenticated",
    "occurred_at": 1899997000,
    "source": "client_core",
    "recoverability": "automatic"
  },
  "counters": {
    "rx_bytes": 4096,
    "tx_bytes": 8192,
    "reconnects": 1,
    "policy_rejections": 0
  }
}
